{
  "schema_version": 2,
  "product": "PeerHub",
  "as_of": "2026-10-09",
  "items": [
    {
      "id": "UNIFIED-MAP",
      "name": "Unified package standard mapping",
      "scope": "target architecture documentation",
      "status": "DESIGN_FROZEN",
      "evidence": [
        "10_STANDARDS_CONFORMANCE/product-conformance.json"
      ],
      "notes": "Standard 1.2 mapping; not implementation claim."
    },
    {
      "id": "M1-IMPLEMENTATION",
      "name": "M1 Durable Communication implementation",
      "scope": "Peer/Stream/Record/Offset + Session Bridge/Observation/Readonly Diag",
      "status": "VERIFIED",
      "candidate_identity": {
        "type": "git_sha",
        "value": "d177722d66929b1e249cb27462b9021fd31c421b"
      },
      "evidence": [
        "07_AUDIT/CURRENT_M1_IMPLEMENTATION_SNAPSHOT_20261005.json",
        "01_M1/ACCEPTANCE_DOD.md",
        "06_GUIDES/TEST_SET/test-catalog.json"
      ],
      "notes": "Candidate-bound: v0.12.4 at d177722; GitHub publish run 37918094937 (release v0.12.4); release-evidence passed over the M1 catalog (live G3 evidence from the maintainer machine). Earlier claim was bound to 4a6994e."
    },
    {
      "id": "M1-PUBLIC-CLI-CUTOVER",
      "name": "M1 default public CLI cutover",
      "scope": "make M1 surface canonical peerhub UX without quota/diag regression",
      "status": "VERIFIED",
      "evidence": [
        "09_ROADMAP/M1_PUBLIC_CLI_CUTOVER_GATE.md"
      ],
      "notes": "peerhub is the only CLI; selector, legacy-import and the 109-command table are removed. Candidate-bound: v0.12.4 at d177722; GitHub publish run 37918094937 (release v0.12.4).",
      "candidate_identity": {
        "type": "git_sha",
        "value": "d177722d66929b1e249cb27462b9021fd31c421b"
      }
    },
    {
      "id": "M2",
      "name": "Durable Work Continuity",
      "scope": "required roadmap",
      "status": "VERIFIED",
      "evidence": [
        "09_ROADMAP/M2_DURABLE_WORK_CONTINUITY.md",
        "09_ROADMAP/M2_DETAILED_PRE_TDD_REVIEW.md"
      ],
      "notes": "Candidate-bound: v0.12.4 at d177722; GitHub publish run 37918094937 (release v0.12.4). release-evidence required every M2 catalog test (docs/m2/test-catalog.m2.json) to PASS in gate G2; contracts and closure notes are in docs/m2 and docs/implementation.",
      "candidate_identity": {
        "type": "git_sha",
        "value": "d177722d66929b1e249cb27462b9021fd31c421b"
      }
    },
    {
      "id": "M3",
      "name": "Federated Intelligent Collaboration",
      "scope": "required roadmap",
      "status": "VERIFIED",
      "evidence": [
        "09_ROADMAP/M3_FEDERATED_INTELLIGENT_COLLABORATION.md",
        "09_ROADMAP/M3_DETAILED_PRE_TDD_REVIEW.md"
      ],
      "notes": "Candidate-bound: v0.12.4 at d177722; GitHub publish run 37918094937 (release v0.12.4). release-evidence required every M3 catalog test (docs/m3/test-catalog.m3.json) to PASS in gate G2; contracts and closure notes are in docs/m3 and docs/implementation.",
      "candidate_identity": {
        "type": "git_sha",
        "value": "d177722d66929b1e249cb27462b9021fd31c421b"
      }
    },
    {
      "id": "M4",
      "name": "Optional Capability Tracks",
      "scope": "evidence-triggered roadmap",
      "status": "PLANNED",
      "evidence": [
        "09_ROADMAP/OPTIONAL_CAPABILITY_TRACKS.md"
      ],
      "notes": "Not mandatory backlog."
    }
  ]
}
